SLUG,PROMOTED_RUN_TITLE,ORGANISATION_TITLE,BUSINESS_MODEL,COUNT_UNIT_ENROLEMENT,UNLIMITED_ENRLEMENTS
leadership-globalised-world,Leadership in a Globalised World,Coventry University,UpgradedAccess,0,0
food-science,Food Science,Davidson Institute of Science Education at the Weizmann Institute of Science,UpgradedAccess,1,0
m189lon-03,m189lon-03,Coventry University,UpgradedAccess,1,0
introduction-to-nursing-science-02,Introduction to Nursing Science 2,Coventry University,NoPurchase,4,0
7055crb-05,7055crb-05,Coventry University,UpgradedAccess,0,0
understanding-systems-thinking-healthcare,Understanding Systems Thinking in Healthcare,Coventry University,NoPurchase,5,0
travel-fiction-j,旅する書物：書物の歴史における日本とヨーロッパの出会い,Keio University,UpgradedAccess,1,0
choosing-the-right-pgce-for-you-or-teacher-training-choosing-the-right-route-for-you,TBC Choosing the right PGCE for you OR Teacher training: choosing the right route for you,Coventry University,UpgradedAccess,0,0
506mansc-sc1,506MANSC-SC1,Coventry University,UpgradedAccess,0,0
religion-gender-sexual-wellbeing,Religion and Sexual Well-being,University of Groningen,UpgradedAccess,1,1
the-secret-power-of-brands,The Secret Power of Brands,UEA (University of East Anglia),UpgradedAccess,99963,164
uva-darden-marketing-analytics,Marketing Analytics,"Darden School of Business, University of Virginia",UpgradedAccess,38458,244
foundations-of-project-management,Foundations of Project Management,Coventry University,UpgradedAccess,24755,713
nursing,Introduction to Nursing,King's College London,SponsoredAccess,23566,0
gravity,"Gravity! The Big Bang, Black Holes and Gravitational Waves",Paris Diderot,NoPurchase,87169,0
discovering-science-science-writing,Discovering Science: Science Writing,University of Leeds,UpgradedAccess,33603,266
bioinformatics,Clinical Bioinformatics,The University of Manchester,UpgradedAccess,21862,90
managing-people-organisational-culture,Managing People: Understanding Your Organisational Culture,University of Reading,UpgradedAccess,5016,192
delivering-research-data-management-services,Delivering Research Data Management Services,The University of Edinburgh,UpgradedAccess,4902,101
depression-young-people,Understanding Depression and Low Mood in Young People,University of Reading,UpgradedAccess,51381,721
player-centred-coaching,Player-centred Coaching,Deakin University,UpgradedAccess,2423,2
working-with-disability,Disability and a Good Life: Working with Disability,UNSW Sydney,NoPurchase,8526,0
atmospheric-chemistry-planets-and-life-beyond-earth,Atmospheric Chemistry: Planets and Life Beyond Earth,University of Leeds,UpgradedAccess,15684,334
demystifying-entrepreneurship,Demystifying Entrepreneurship: How to Think Like an Entrepreneur,Coventry University,UpgradedAccess,6046,104
sustainable-futures,Unleash Your Potential: Sustainable Futures,University of Bristol,UpgradedAccess,14681,265
grow-from-soil-to-sky,Citizen Science: From Soil to Sky,University of Dundee,SponsoredAccess,8738,0
clinical-supervision-professional-development,Clinical Supervision: Planning Your Professional Development,UEA (University of East Anglia),UpgradedAccess,5574,227
designing-future-where-learning-is-lifestyle,Designing a Future Where Learning is a Lifestyle,Samsung,SponsoredAccess,2286,0
multiculturalism-in-asean,Multiculturalism In ASEAN,Universiti Malaya,UpgradedAccess,173,24
data-science-artificial-intelligence,Get ready for a Masters in Data Science and AI,Coventry University,UpgradedAccess,5292,108
maths-subject-knowledge-graphs-functions,"Maths Subject Knowledge: Graphs, Functions and Solving Equations Graphically",National STEM Learning Centre,PaidForAccess,896,54
governing-religion-global-challenges-and-comparative-approaches,Governing Religion: Global Challenges and Comparative Approaches,European University Institute (EUI),UpgradedAccess,2574,141
sustainable-futures-private,Sustainable Futures: Make a Difference,University of Bristol,NoPurchase,69,0
mpl700-3,MPL700.3 What’s Luck Got To Do With It?,Deakin University,NoPurchase,730,0
stem-ambassador-induction-trans-pennine,STEM Ambassadors Induction - Trans-Pennine,STEM Ambassadors,SponsoredAccess,552,0
impact-of-trauma-on-mental-health,Impact of Trauma on Mental Health,The University of Glasgow,NoPurchase,442,0
breastfeeding-for-medical-students-closed,UofG breastfeeding-for-medical-students-,The University of Glasgow,SponsoredAccess,323,0
advanced-mentoring,Advanced mentoring skills for experienced mentors,Education and Training Foundation (ETF),NoPurchase,203,0
ctpd-i2a02,Children's Typical Psychological Development including Developmental Theories,Anglia Ruskin University,NoPurchase,46,0
defining-global-marketing-c2,Global Marketing: A Definition (C),Coventry University,NoPurchase,70,0
skeletal-analysis,Written in Bone: An Introduction to Forensic and Bio-archaeology,Griffith University,UpgradedAccess,3898,116
effective-online-teacher,Online Teaching: Creating Courses for Adult Learners,The Open University,NoPurchase,911,0
negotiation-for-women-in-the-workplace,Salary Negotiation for Women in the Workplace,Hustle Crew,UpgradedAccess,3049,80
reward-and-performance-management-c,Reward and Performance Management (C),Coventry University,NoPurchase,21,0
futurelearn-infosec-course,Information Security Awareness and Education Training,FutureLearn Staff,NoPurchase,127,0
state-mnc-relationships-primary-and-manufacturing-sectors,State–MNC Relationships in the Primary and Manufacturing Sectors,Coventry University,NoPurchase,52,0
socs3200-3,SOCS3200.3 - Presenting your research,The University of Newcastle Australia,NoPurchase,58,0
break-even-analysis-c,Break-even Analysis (C-LON),Coventry University,NoPurchase,30,0
introduction-to-food-systems,"An Introduction to Food Systems: Scientific, Technical and Socioeconomic Principles to Facilitate the Creation of Food Value Networks",EIT Food,SponsoredAccess,413,0
assessing-and-managing-trends-and-risks,Assessing and Managing Trends and Risks,Coventry University,NoPurchase,32,0
job-analysis-competency-management-oc,Job Analysis and Competency Mapping: Methods and Approaches,Coventry University,NoPurchase,33,0
customer-experience-design-competitive-positioning,Customer Experience Design: Competitive Positioning,Swiss Education Group,NoPurchase,10,0
cultivate-competitive-advantage-,Classify Resources to Cultivate Competitive Advantage and Understand the Purpose of Corporate Social Responsibility,Coventry University,NoPurchase,61,0
f5006fd-sc4,"Pharmacology – Side Effects, Contraindications and Cautions",Coventry University,NoPurchase,23,0
continuum-of-ageing-and-dying-course-1,The Continuum of Ageing and Dying: Weeks 1 - 6,The University of Glasgow,NoPurchase,26,0
social-entrepreneurship-in-educational-technology-ideation-market-research,Social Entrepreneurship in Educational Technology: Ideation and Market Research,Johns Hopkins University,ExpertTrackAccess,3,0
introduction-organisational-behaviour-kick-start,An Introduction to Organisational Behaviour: How to Understand Your People - BeReady Kickstart,Coventry University,NoPurchase,43,0
technical-report-writing-for-engineers-private,Technical Report Writing for Engineers,The University of Sheffield,NoPurchase,49,0
flo-kate-beatrix-course-on-tea,"Flo, Kate and Beatrix's course on tea",FutureLearn,NoPurchase,18,0
global-citizenship-private,Global Citizenship,University of Bristol,NoPurchase,69,0
unit-rate-calculations-reporting-examining,Unit Rate Calculations Continued and Examining and Reporting on Tenders,Coventry University,NoPurchase,27,0
making-inferences-correlation-regression-analysis-c,Making Inferences: Correlation and Regression Analysis (C),Coventry University,NoPurchase,41,0
independent-research-project-research-design-cmbim-oc,Independent Research Project: Research Design (CMBIM),Coventry University,NoPurchase,6,0
engl3013-4,ENGL3013.4 Speaking for Themselves,The University of Newcastle Australia,NoPurchase,57,0
independent-research-project-research-design-c-baib,Independent Research Project: Research Design (BAIB),Coventry University,NoPurchase,9,0
google-for-education-promote-group-work-inspire-creativity,Google for Education: How to Promote Group Work and Inspire Creativity,Tablet Academy,ExpertTrackAccess,5,0
social-enterprise-policymakers-masterclass,Developing Effective Policies to Build the Impact Economy,British Council,UpgradedAccess,19,0
datajournalism,Data Journalism: Turning dreary numbers into interactive news stories,Hong Kong Baptist University,NoPurchase,70,0
f5006fd-sc7,Medicines Storage Considerations,Coventry University,NoPurchase,20,0
legal-ethical-context-cyber,The legal and ethical context.,Coventry University,NoPurchase,21,0
introduction-work-and-wellbeing-at-work,Wellbeing at Work: An Introduction,Coventry University,NoPurchase,8,0
business-strategy-art-of-looking-into-the-future-c,Business Strategy: The Art of Looking into the Future (C),Coventry University,NoPurchase,13,0
7123exq-05,Research Project - 7123EXQ - 05,Coventry University,UpgradedAccess,0,0
anatomical-obsevation,Anatomical observation,Newcastle University,UpgradedAccess,3,0
introduction-engagement-and-motivation-at-work,Employee Engagement and Motivation: An Introduction,Coventry University,NoPurchase,7,0
performance-appraisal-for-logistics-and-sources-of-capital,Performance Appraisal for Logistics and Sources of Capital,Coventry University,NoPurchase,7,0
unit-rate-calculations-reporting-examining-c,Unit Rate Calculations Continued and Examining and Reporting on Tenders (C),Coventry University,NoPurchase,11,0
maths-subject-knowledge-graphs-functions-private,"Maths Subject Knowledge: Graphs, Functions and Solving Equations Graphically (P)",National STEM Learning Centre,SponsoredAccess,5,0
accounting-for-the-changing-world,Accounting for Today’s Dynamic World,Auckland University of Technology (AUT),UpgradedAccess,3,0
policy-formulation-analysis-in-healthcare,Policy Formulation and Analysis in Healthcare,Coventry University,NoPurchase,5,0
key-foundations-of-a-job-application-oc,Key Foundations of a Job Application,Coventry University,NoPurchase,2,0
virtual-reality-for-health-professions-education,Virtual Reality Education for Health Professions,Taipei Medical University,UpgradedAccess,1,0
hand-and-arm-exercises-for-rheumatoid-arthritis-,TBC Hand and arm exercises for rheumatoid arthritis.,University of Exeter,UpgradedAccess,0,0
m189lon-04,m189lon-04,Coventry University,UpgradedAccess,1,0
made-in-kenya-an-introduction-to-sustainably-sourcing-and-producing-locally,Inclusive Fashion: Lessons in Fashion Democracy from the Global South,The Hopenclass,ExpertTrackAccess,0,0
data-science,Introduction to R for Data Science,Purdue University,UpgradedAccess,22764,146
mathematical-symbolism,Getting a Grip on Mathematical Symbolism,Loughborough University,NoPurchase,31935,0
blended-learning-digital-skills,Blended Learning Essentials: Developing Digital Skills,University of Leeds,ExpertTrackAccess,17295,251
planning-your-personal-development,Management and Leadership,The Open University,UpgradedAccess,33628,500
biological-psychology,Introduction to Psychology: Biological Psychology,Monash University,ExpertTrackAccess,42501,137
emi-academics,English as a Medium of Instruction for Academics,University of Southampton,UpgradedAccess,52804,277
target-antibiotics,TARGET Antibiotics – Prescribing in Primary Care,BSAC,UpgradedAccess,5500,130
circular-business-models-for-sustainable-urban-food-systems,Circular Business Models for Sustainable Urban Food Systems,EIT Food,UpgradedAccess,4969,87
european-culture,European Culture and Politics,University of Groningen,UpgradedAccess,20420,61
engaging-with-autism,Supporting and Engaging People with Autism,Swinburne University of Technology,SponsoredAccess,20666,0
introduction-to-norwegian-2,Introduction to Norwegian 2,University of Oslo,UpgradedAccess,8073,166
evidence-and-data-collection-for-problem-solving,Evidence and Data Collection for Problem Solving,University of Leeds,ExpertTrackAccess,21167,0
raising-startup-funds,Raising Funds for Your Startup,Grenoble Ecole de Management,UpgradedAccess,5148,60
preparing-to-learn-online-at-university,Preparing to Learn Online at University,University of Leeds,UpgradedAccess,5868,118
sit718-4,SIT718.4 Linear Programming,Deakin University,NoPurchase,1368,0
protecting-health-data,Protecting Health Data in the Modern Age,University of Groningen,UpgradedAccess,7173,243
crime-fiction,Classic Detective Fiction,The University of Newcastle Australia,UpgradedAccess,3032,203
university-of-colorado-mini-medical-school-part-1,Mini Medical School: Introduction to Medical Science,University of Colorado,UpgradedAccess,1774,59
ads712-1,ADH712.1 The World Food Problem,Deakin University,NoPurchase,241,0
introduction-to-virtual-reality,"Introduction to Virtual, Augmented and Mixed Reality",Lancaster University,SponsoredAccess,7104,0
risk-incidents-leadership,Emergency Management,Coventry University,UpgradedAccess,5150,177
gaming-big-data,Data Science in the Games Industry,University of Dundee,UpgradedAccess,5622,55
leading-managing-team-c,Leading and Managing a Team (C),Coventry University,NoPurchase,182,0
managing-your-health-data,Managing Your Health Data,EIT,UpgradedAccess,832,3
introduction-to-the-middle-east-and-north-africa,Introduction to the Middle East and North Africa,"Foreign, Commonwealth & Development Office",SponsoredAccess,203,0
error-based-learning-and-ensemble-approaches,Machine Learning: Error Based Learning and Ensemble Approaches,Dublin City University,NoPurchase,100,0
systems-thinking-for-sustainability-drawing-complexity-on-paper-introduction-to-system-mapping,Systems Thinking for Sustainability: Drawing complexity on a paper,Except Integrated Sustainability ,ExpertTrackAccess,32,0
conservatism-triumphant,HIST1002.4: Conservatism Triumphant?,The University of Newcastle Australia,NoPurchase,124,0
azure-cloud-fundamentals,Microsoft Future Ready: Azure Cloud Fundamentals,"CloudSwyft Global Systems, Inc.",UpgradedAccess,1441,65
mmp742-5,MMP742.5 Analysing the Influence of Uncertainties and Considering Indirect Property Investments,Deakin University,NoPurchase,153,0
soca2065-2,SOCA2065.2: Production Lines,The University of Newcastle Australia,NoPurchase,217,0
creativity-innovation-c,Creativity and Innovation (C),Coventry University,NoPurchase,60,0
leadership-c1,Leadership (C1),Coventry University,NoPurchase,176,0
future-of-cryptography,The Future of Cryptography,Coventry University,NoPurchase,96,0
adh702-5,ADH702.5: Complex challenges and opportunities for the future,Deakin University,NoPurchase,103,0
sc2-research-methodology-c,Research Methodology (C),Coventry University,NoPurchase,46,0
digital-skills-mobile-acg-tag,Digital Skills: Mobile ACG & TAG,Accenture,SponsoredAccess,98,0
ds-mobile-acg,Digital Skills: Mobile ACG & TAG,Accenture Private,SponsoredAccess,82,0
cloudswyft-msft-dv-a-practical-approach-for-absolute-beginners,Data Visualisation Fundamentals for Absolute Beginners,"CloudSwyft Global Systems, Inc.",ExpertTrackAccess,77,0
engl2101-1,ENGL2101.1: Structure,The University of Newcastle Australia,NoPurchase,180,0
faces-of-dementia,The Many Faces of Dementia,UCL (University College London) ,UpgradedAccess,79182,573
health-technology-assessment,Introduction to Health Technology Assessment,The University of Glasgow,UpgradedAccess,3951,49
victorian-film,The Living Picture Craze: An Introduction to Victorian Film,The British Film Institute (BFI),UpgradedAccess,5942,246
the-evolution-of-management,The Evolution of Management and Leadership Theory,Coventry University,UpgradedAccess,1735,103
security-operations,Security Operations,Coventry University,UpgradedAccess,1978,73
how-to-read-a-poem-york,Poetry: How to Read a Poem,University of York,UpgradedAccess,12388,324
creativity-as-a-driver-for-innovation-c,Creativity as a Driver for Innovation (C),Coventry University,NoPurchase,55,0
vaccines-covid-19,Vaccine Development: Finding a Vaccine for COVID-19 and Future Pandemics,BSAC,UpgradedAccess,4228,256
effective-livestock-production,Effective Livestock Production with Low Use of Antibiotics,Swedish University of Agricultural Sciences (SLU),UpgradedAccess,4037,51
global-tourism-development-trends,China’s Role in Global Tourism Development,Nankai University,ExpertTrackAccess,3288,59
demonstrating-academic-language-and-skills,Demonstrating Academic Language and Skills,Coventry University,NoPurchase,112,0
hnd702-4,HND702.4 Type 1 Management Toolbox,Deakin University,NoPurchase,722,0
better-emails,Writing Better Emails,British Council,PaidForAccess,312,0
society-and-bioeconomy,Introduction to Sustainable Bioeconomy,University of Padova,UpgradedAccess,934,64
hotel-market-analysis-valuation-private,How to Perform a Hotel Market Analysis and Valuation,Glion Institute of Higher Education,SponsoredAccess,1603,0
understanding-gender-identity,Understanding Gender Identity,The Open University,PaidForAccess,312,0
managing-culture-as-leaders-et,International Leadership: Managing Culture as Leaders,Coventry University,ExpertTrackAccess,58,0
analysing-data-ibm,Analysing Data (IBM),Coventry University,NoPurchase,59,0
7035cem-05,Solving Business Problems,Coventry University,NoPurchase,79,0
sisterhood-works-build-a-more-meaningful-network-,Sisterhood Works: How to Build a More Meaningful Network,AllBright,ExpertTrackAccess,50,0
digital-diplomacy,Digital Diplomacy,Global Diplomatic Forum,SponsoredAccess,137,0
culture-in-global-marketing-c-ibm,Culture in International and Global Marketing (IBM),Coventry University,NoPurchase,160,0
global-marketing-a-definition-c-ibm,International and Global Marketing: A Definition (IBM),Coventry University,NoPurchase,194,0
introduction-to-strategy-c,Strategy as a Process and Measures of Success: An Introduction (C),Coventry University,NoPurchase,182,0
understanding-development-contexts-course-1,Understanding Development Contexts,The Open University,NoPurchase,95,0
rewarding-excellence-c,Supporting International Employees (C),Coventry University,NoPurchase,51,0
mental-health-stress-oc,Mental Health and Stress Management: The Business Case,Coventry University,NoPurchase,25,0
organisational-corporate-social-responsibility-c,Organisational Corporate Social Responsibility (C),Coventry University,NoPurchase,41,0
challenges-for-human-resource-management,Challenges for Human Resource Management,Coventry University,NoPurchase,40,0
network-environments,Network Environments,Coventry University,NoPurchase,75,0
inventory-management-and-economic-ordering-c,Inventory Management and Economic Ordering (C),Coventry University,NoPurchase,69,0
project-planning-business-planning-ethics-oc,"Evidence-based Practice, Project Planning and Ethics",Coventry University,NoPurchase,22,0
adh733-4,"ADH733.4 Growth, Globalisation and Trade",Deakin University,NoPurchase,40,0
multimorbidity-case-management,Multimorbidity and Case Management,Coventry University,NoPurchase,79,0
leadership-and-emergency-management-c,Leadership and Emergency Management,Coventry University,NoPurchase,16,0
principles-management-leadership-healthcare-a,Introduction to the Principles of Management and Leadership in Healthcare (A),Coventry University,UpgradedAccess,0,0
religion-gender-and-sexual-wellbeing-from-sexual-reproductive-health-and-rights-to-piety-and-pleasure,"Religion and Sexuality: Pleasure, Piety, and Reproductive Rights",University of Groningen,UpgradedAccess,0,0
sustainable-transportation,Sustainable Transportation,Coventry University,NoPurchase,18,0
f5006fd-sc9,F5006FD - SC9,Coventry University,UpgradedAccess,0,0
create-a-robust-go-to-market-strategy,Create a Robust Go to Market Strategy,The EntrepreneurNOW! Network (ENN),PaidForAccess,9,0
iot-security-case-studies,IoT Security Case Studies,Coventry University,NoPurchase,47,0
rr-corporate-governance,Corporate Finance: Corporate Governance,The Open University,NoPurchase,19,0
maqasid-al-syariah-and-sustainable-development,Maqasid al-Syariah and Sustainable Development,Universiti Malaya,UpgradedAccess,4,0
entrepreneurship-four,Risk and Resilience,Coventry University,UpgradedAccess,6,0
data-science-healthcare-real-world-evidence-spanish,Data Science for Healthcare: Using Real World Evidence - Spanish,EIT,UpgradedAccess,2,0
an-introduction-to-cryptography,An Introduction to Cryptography,Coventry University,NoPurchase,5,0
lymphatic-science,Lymphatics: The Impact of Lymphatic Science on Medical Practice,"St George's, University of London",UpgradedAccess,4,0
fashion-values-fashion-economy,TBC Fashion Values: Fashion & Economy,London College of Fashion,UpgradedAccess,5,0
digital-tribes-listening-to-customers,"Digital Tribes, Listening to Customers and New Trends",Anglia Ruskin University,NoPurchase,8,0
projects-and-people-c,Projects and People (C),Coventry University,UpgradedAccess,1,0
introduction-to-malware-investigations,Introduction to Digital Forensics: Malware Analysis and Investigations,PA Consulting,ExpertTrackAccess,1,0
develop-in-swift-fundamentals-navigation-and-workflows,TBC Develop in Swift Fundamentals: Navigation and Workflows,FutureLearn,UpgradedAccess,0,0
research-philosophies-ethics-preparation-for-research-oc,"Research Philosophies, Research Ethics and Preparations for Research",Coventry University,NoPurchase,0,0
complex-emergencies-civil-military-relations-oc,Complex Emergencies and Civil-military Relations,Coventry University,NoPurchase,0,0
post-growth-economics-foundations-for-the-economy-of-tomorrow,Sustainable Economics: Foundations for a Post-Growth Future,University of Surrey,UpgradedAccess,1,0
business-process-management,Business Process Management,Queensland University of Technology,UpgradedAccess,23233,10
good-brain-bad-brain-drugs,"Good Brain, Bad Brain: Drug Origins",University of Birmingham,UpgradedAccess,53843,284
nhs-values-nursing-midwifery,Understanding NHS Values,King's College London,UpgradedAccess,5790,2
resourcing-the-organisation,Resourcing the Organisation,Coventry University,NoPurchase,159,0
study-uk-preparing-for-work,Study UK: Preparing for work,British Council,SponsoredAccess,22484,0
networking-with-python-socket-programming-for-communication,Networking with Python: Socket Programming for Communication,Raspberry Pi Foundation,UpgradedAccess,5339,108
literature,Literature and Mental Health,The University of Warwick,UpgradedAccess,51889,6
overcoming-imposter-syndrome,Overcoming Imposter Syndrome,University of Southern Queensland,SponsoredAccess,28591,0
discovering-science-global-challenges,Discovering Science: Global Challenges,University of Leeds,UpgradedAccess,10098,101
how-to-make-a-poem,How To Make A Poem,Manchester Metropolitan University,UpgradedAccess,29056,281
video-game-design-development,Video Game Design and Development,Abertay University,UpgradedAccess,11556,122
exploring-possible-futures,Exploring Possible Futures,University of Basel,UpgradedAccess,6366,47
introduction-to-content-design,Introduction to Content Design,Government Digital Service,UpgradedAccess,21394,237
hans-christian-andersens-fairy-tales,Hans Christian Andersen’s Fairy Tales,Hans Christian Andersen Centre,UpgradedAccess,33752,4
exploring-copyright,"Exploring Copyright: History, Culture, Industry",International Confederation of Societies of Authors and Composers (CISAC),UpgradedAccess,15029,167
post-traumatic-stress-disorder-ptsd-in-the-global-context,Post-Traumatic Stress Disorder (PTSD) in the Global Context,The University of Glasgow,UpgradedAccess,3196,237
humphry-davy,Humphry Davy,Lancaster University,UpgradedAccess,4658,59
teaching-primary-science-chemistry,Teaching Primary Science: Chemistry,National STEM Learning Centre,PaidForAccess,2804,108
data-masterclass,Data Masterclass for Senior Leaders,10 Downing Street Data Science Team,SponsoredAccess,1092,0
introduction-into-3d-modelling-animation,Introduction to 3D Animation using Blender,VR Voom,UpgradedAccess,5704,51
inequality-in-latin-america,Inequalities in Latin America and the Caribbean,UNESCO,UpgradedAccess,2449,13
social-media-in-healthcare,Social Media in Healthcare,Taipei Medical University,UpgradedAccess,13692,107
gezondheid-na-zwangerschap,Gezondheid na je zwangerschap,University of Groningen,UpgradedAccess,649,4
mapper,Mapper: Navigating Digital Career Tools,Founders4Schools,UpgradedAccess,2348,33
managing-company-culture,Managing Company Culture Whilst Responding to Environmental Challenges,Coventry University,UpgradedAccess,211,38
holocaust-teaching,Teaching the Holocaust,UCL (University College London) ,UpgradedAccess,2616,46
through-engineers-eyes-introducing,Through Engineers' Eyes - Introducing the Vision,UNSW Sydney,UpgradedAccess,801,1
fungal-diagnostics,Fungal Diagnostics in Critically Ill Patients,BSAC,UpgradedAccess,528,51
technical-curriculum-design-working-with-standards,Technical Curriculum Design: Principles and Models of Curriculum Design,Education and Training Foundation (ETF),SponsoredAccess,252,0
hist2006-4,HIST2006.4: Crime as Spectacle in the 20th Century,The University of Newcastle Australia,NoPurchase,240,0
antibiotic-resistance-non-fermenting-gram-negative-bacteria,Challenges in Antibiotic Resistance: Non-Fermenting Gram Negative Bacteria,BSAC,UpgradedAccess,508,36
rewarding-excellence,Supporting International Employees,Coventry University,NoPurchase,37,0
client-needs-c6,Client Needs (C6),Coventry University,NoPurchase,162,0
globalisation-disease-occurrence-oc,Globalisation and Disease Occurrence,Coventry University,NoPurchase,75,0
business-management-and-leadership,Business Management and Leadership,The University of Kent,ExpertTrackAccess,43,0
engl2011-3,ENGL2011.3: Cultural Contexts,The University of Newcastle Australia,NoPurchase,113,0
f5007fd-sc5,Critical Appraisal of Evidence 2,Coventry University,NoPurchase,23,0
strategic-leaders-providing-t-levels,Strategic Leaders Providing T Levels,Education and Training Foundation (ETF),SponsoredAccess,176,0
