SLUG,PROMOTED_RUN_TITLE,ORGANISATION_TITLE,BUSINESS_MODEL,COUNT_UNIT_ENROLEMENT,UNLIMITED_ENRLEMENTS
starting-a-business-3,Starting a Business 3: Customers and Competitors,University of Leeds,UpgradedAccess,50617,272
introduction-to-forensic-science,Introduction to Forensic Science,University of Strathclyde,UpgradedAccess,125766,535
precalculus,Precalculus,University of Padova,UpgradedAccess,20732,196
bookkeeping-financial-accounting,Bookkeeping for Personal and Business Accounting,The Open University,UpgradedAccess,81244,297
heart-and-circulatory-diseases,It Starts with Your Heart: Understanding Heart and Circulatory Diseases,British Heart Foundation,UpgradedAccess,10474,284
online-learning,How to Learn Online: Getting Started,The Open University,UpgradedAccess,50727,164
wellington-and-waterloo,Wellington and the Battle of Waterloo,University of Southampton,UpgradedAccess,7913,7
consumer-behaviour-and-psychology,Consumer Behaviour and Psychology,Coventry University,UpgradedAccess,17954,321
digital-storytelling,Digital Storytelling,University of Birmingham,NoPurchase,68409,0
advanced-machine-learning,Advanced Machine Learning,The Open University,UpgradedAccess,5338,17
introduction-to-financial-accounting-organizations-decisions-through-numbers,Introduction to Financial Accounting,University of Padova,UpgradedAccess,11299,164
data-science-real-world-evidence,Data Science for Healthcare: Using Real World Evidence,EIT InnoEnergy,UpgradedAccess,1290,1
managing-covid-19-in-primary-care,Managing COVID-19 in Primary Care,"St George's, University of London",UpgradedAccess,27938,462
understanding-global-development-management,Understanding Global Development Management,The Open University,UpgradedAccess,3300,133
slavery,Ending Slavery,The University of Nottingham,UpgradedAccess,8425,0
modern-korean-history,Modern Korean History,Yonsei University,NoPurchase,8185,0
pandemics-modelling-and-policy,"COVID-19: Pandemics, Modelling, and Policy",UNESCO UNITWIN Complex Systems Digital Campus,UpgradedAccess,6882,235
ocean-science-in-action-addressing-marine-ecosystems-and-food-security-in-the-western-indian-ocean,Ocean Science in Action: Addressing Marine Ecosystems and Food Security,National Oceanography Centre,UpgradedAccess,3311,116
media-literacy-representation,Understanding Media: Introduction to Media Literacy and Representation,The University of Newcastle Australia,UpgradedAccess,2638,76
personalized-medicine,Using Personalized Medicine and Pharmacogenetics,UEA (University of East Anglia),UpgradedAccess,3883,41
secure-android-app-development,Secure Android App Development,University of Southampton,NoPurchase,7104,0
sit718-1,SIT718.1 Introduction to Data Analysis,Deakin University,NoPurchase,1363,0
solar-pv,Go Solar PV: The Business Potential of Solar Photovoltaics,EIT InnoEnergy,UpgradedAccess,9496,57
subject-pedagogy-professional-development-secondary,Subject Pedagogy: Professional Development,Coventry University,NoPurchase,165,0
introduccion-a-la-microbiologia-practica,Introducción a la microbiología práctica,BSAC,UpgradedAccess,413,7
be-a-dentist,Becoming a Dentist,The University of Glasgow,UpgradedAccess,494,2
depreciation-and-budgetary-control-c,Depreciation and Budgetary Control (C),Coventry University,NoPurchase,18,0
stem-ambassador-induction-south-east,STEM Ambassadors Induction - South East,STEM Ambassadors,SponsoredAccess,772,0
email-website-marketing,Master Digital Marketing: The Marketing Mix,The Left Bank,ExpertTrackAccess,50,0
transitie-oudere-kwetsbare-patient,Transitie van de kwetsbare oudere patiënt,E-Infuse,SponsoredAccess,647,0
new-economy-c,New Economy and Business Analytics (C),Coventry University,NoPurchase,181,0
leadership-and-emergency-management,Leadership and Emergency Management,Coventry University,NoPurchase,144,0
processes-methods-resourcing-talent-management,Human Resource Management: Processes and Methods of Resourcing and Talent Management,The Open University,NoPurchase,66,0
allocating-resources-c,Allocating Resources (C),Coventry University,NoPurchase,176,0
health-assessment-soh,Health Assessment in Nursing,Coventry University,NoPurchase,67,0
global-supply-chain-management-functions-c,Global Supply Chain Management Functions (C),Coventry University,NoPurchase,117,0
international-development,What is International Development?,UEA (University of East Anglia),UpgradedAccess,5955,145
epargner-et-investir,Epargner et Investir,Grenoble Ecole de Management,UpgradedAccess,8064,24
intro-to-quantum-computing,Understanding Quantum Computers,Keio University,UpgradedAccess,13197,129
construction-project-management,Construction Project Management: An Introduction,Coventry University,UpgradedAccess,2604,67
future-challenges-effective-crisis-management,Future Challenges and Maintaining Effective Crisis Management,Coventry University,NoPurchase,55,0
analysing-data-a,Analysing Data (A),Coventry University,NoPurchase,23,0
sit763-fl2,SIT763.2 Planning for Information Security,Deakin University,NoPurchase,522,0
intro-to-quantum-computing-j,量子コンピュータ入門,Keio University,UpgradedAccess,92,1
joint-contract-tribunal-c,Introduction to the Joint Contract Tribunal (JCT) (C),Coventry University,NoPurchase,57,0
bim-project-lifecycle-c,BIM - Project Lifecycle Management (C),Coventry University,NoPurchase,34,0
organ-toxicology,Organ Toxicology,Hong Kong Baptist University,NoPurchase,218,0
adh702-2,ADH702.2: International initiatives to strengthen the nexus,Deakin University,NoPurchase,102,0
stem-enthuse-partnership-coach,ENTHUSE Partnership Coach Induction,National STEM Learning Centre,SponsoredAccess,66,0
fmcs2200-1,FMCS2200.1: Taking Popular Culture Seriously,The University of Newcastle Australia,NoPurchase,191,0
dsp-mobility-ne-lep,Digital Skills: Mobility (St Joseph's Academy),Accenture Skills to Succeed and North East Local Enterprise Partnership ,NoPurchase,38,0
creativity,Creativity,Coventry University,NoPurchase,1525,0
why-research-matters-assessment,Why Research Matters: Assessment,Deakin University,NoPurchase,75,0
crm-fundamentals,CRM Fundamentals and Practice,FutureLearn,NoPurchase,82,0
ethical-legal-implications-ai,Legal and Ethical Implications in Artificial Intelligence (AI) Development,Coventry University,NoPurchase,68,0
introduction-to-nursing-science-11,Introduction to Nursing Science 11,Coventry University,NoPurchase,4,0
dsp-socialmedia-tp,Digital Skills: Social Media,Accenture Skills to Succeed and Tomorrow's People,NoPurchase,40,0
business-model-innovation-c,Business Model Innovation (C),Coventry University,NoPurchase,12,0
transitie-oudere-kwetsbare-patient-4,Transitie van de oudere kwetsbare patiënt - 4,E-Infuse,NoPurchase,17,0
sc2-research-methodology-oc,Research Methodology,Coventry University,NoPurchase,14,0
international-approaches-evolving-context-business-crisis-management-c,International Approaches and the Evolving Context of Business and Crisis Management,Coventry University,NoPurchase,12,0
digital-business-ecommerce-marketing-strategy,Digital Business E-Commerce and Marketing Strategy,Coventry University,NoPurchase,17,0
how-to-effectively-change-eating-behaviours-personalized-nutrition-and-psychological-approaches,Changing Eating Behaviours and Personalised Nutrition,EIT Food,SponsoredAccess,25,0
m193lon-02,m193lon-02,Coventry University,UpgradedAccess,4,0
entrepreneurship-from-idea-generation-to-action-private,TBC Entrepreneurship: From idea generation to action,King's College London,UpgradedAccess,12,0
managing-diverse-workforce,Managing a Diverse Workforce,Coventry University,NoPurchase,24,0
exploring-strategy-development,Exploring Strategy Development,Deakin University,NoPurchase,31,0
civic-engagement-through-digital-action,Digital Activism: Driving Social Change with Technology,Biji-biji Initiative,UpgradedAccess,0,0
estimating-oc,Estimating,Coventry University,NoPurchase,16,0
researchmethodology-healthcare-research-oc,Healthcare Research,Coventry University,NoPurchase,14,0
discrete-event-and-system-dynamics-approaches,Discrete Event and System Dynamics Approaches,Coventry University,NoPurchase,17,0
social-entrepreneurship-in-educational-technology-concept-development-prototyping,Social Entrepreneurship in Educational Technology: Concept Development and Prototyping,Johns Hopkins University,ExpertTrackAccess,1,0
stem-curriculum-learning-careers,Linking STEM Curriculum Learning to Careers,National STEM Learning Centre,UpgradedAccess,2,0
intercultural-studies-final-assessment,An Introduction to Thinking Interculturally: Final Assessment,University of Leeds,UpgradedAccess,1,0
lever-des-fonds-pour-ma-startup-private,Lever des Fonds pour ma Startup,Grenoble Ecole de Management,UpgradedAccess,0,0
delivering-your-academic-business-report-oc,Delivering Your Academic Business Report,Coventry University,NoPurchase,0,0
emergency-planning-and-preparedness-practice-oc,Emergency Planning and Preparedness Practice,Coventry University,UpgradedAccess,0,0
develop-in-swift-explorations-organizing-data,TBC Develop in Swift Explorations: Organizing Data,FutureLearn,ExpertTrackAccess,0,0
divisional-performance-ibm,Divisional Performance (IBM) DO NOT USE,Coventry University,NoPurchase,0,0
assisted-dying,Assisted Dying: Rhetorics and Reality,The University of Glasgow,UpgradedAccess,3,0
operate-a-drone-for-security-purposes,How to Use a Drone for Security Purposes,The Institute for Drone Technology,UpgradedAccess,0,0
identity-and-the-good-life-sc4,Identity and the Good Life SC4,Coventry University,UpgradedAccess,0,0
disaster-management,Introduction to Humanitarian Aid,Deakin University,UpgradedAccess,23381,165
intro-to-japanese-subculture,An Introduction to Japanese Subcultures,Keio University,UpgradedAccess,26577,229
crime-to-punishment,From Crime to Punishment,University of York,UpgradedAccess,35867,343
english-pronunciation,English Pronunciation in a Global World,Vrije Universiteit Amsterdam,UpgradedAccess,90588,453
smart-cities,Smart Cities,The Open University,UpgradedAccess,42543,55
how-to-create-great-online-content,How to Create Great Online Content,University of Leeds,ExpertTrackAccess,66133,0
teaching-practical-science-physics,Teaching Practical Science: Physics,National STEM Learning Centre,ExpertTrackAccess,10412,118
biology-basic-concepts,Why Biology Matters: Basic Concepts,Pompeu Fabra University Barcelona,UpgradedAccess,2465,28
modern-building-design,Modern Building Design,University of Bath,UpgradedAccess,23252,158
italian-for-literature,Studying in Italian - Language and Literature,Università per Stranieri di Siena (UniStraSi),UpgradedAccess,7298,13
digital-learning,Transforming Digital Learning,Deakin University,UpgradedAccess,26909,297
investing-technology,Innovations in Investment Technology: Artificial Intelligence,University of Michigan,ExpertTrackAccess,4849,98
global-governance,International Affairs: Global Governance,The Graduate Institute of International and Development Studies,UpgradedAccess,9323,41
japanese-avant-garde-art-butoh,Exploring Japanese Avant-garde Art Through Butoh Dance,Keio University,UpgradedAccess,5560,88
bacterial-genomes-access-and-analysis,Bacterial Genomes II: Accessing and Analysing Microbial Genome Data Using Artemis,Wellcome Connecting Science,SponsoredAccess,16846,0
point-prevalence-surveys,Challenges in Antibiotic Resistance: Point Prevalence Surveys,BSAC,UpgradedAccess,8921,149
concurrent-programming-erlang,Concurrent Programming in Erlang,The University of Kent,UpgradedAccess,3536,8
battle-of-dunbar-1650,Archaeology and the Battle of Dunbar 1650: From the Scottish Battlefield to the New World,Durham University,UpgradedAccess,5344,286
what-is-korean-philosophy,Introduction to Korean Philosophy,Sungkyunkwan University (SKKU) ,UpgradedAccess,4313,131
data-management-and-visualisation-data-driven-visualisations,Data Management and Visualisation: Data Driven Visualisations,Dublin City University,NoPurchase,57,0
learning-online-with-deakin,Learning online at Deakin,Deakin University,NoPurchase,1772,0
fam-pregnancy,Food as Medicine: Fertility and Pregnancy,Monash University,PaidForAccess,747,0
data-analysis-fundamentals-in-excel,Analysing Data in Excel,Filtered,UpgradedAccess,3090,102
introduction-to-haccp,Introduction to HACCP for Food Safety,International Culinary Studio,UpgradedAccess,128,1
social-enterprise-growing-a-sustainable-business,Social Enterprise: Growing a Sustainable Business,Minca Ventures,UpgradedAccess,656,38
ads701-3,"ADS701.3 Poverty, Freedom and Empowerment",Deakin University,NoPurchase,96,0
perspectives-entrepreneurship,Perspectives on Entrepreneurship,Coventry University,UpgradedAccess,564,27
lsc-private,Introduction to Catalan Sign Language,Pompeu Fabra University Barcelona,NoPurchase,726,0
software-development-fundamentals-project-management,Software Development Fundamentals: Project Management,FutureLearn,ExpertTrackAccess,123,0
effective-end-point-assessment-preparing-for-success,Effective Technical Teaching: Preparing for End-Point Assessment Success,Education and Training Foundation (ETF),SponsoredAccess,488,0
teaching-primary-science-body-processes,Teaching Primary Biology: Body Processes,National STEM Learning Centre,PaidForAccess,531,46
workforce-planning-education-ethics-c,Workforce Planning Education and Ethics (C),Coventry University,NoPurchase,138,0
distributed-ledger-technologies,Blockchain Basics and Applications: Distributed Ledger Technologies,Dublin City University,NoPurchase,83,0
digital-divide,The Digital Divide,Coventry University,NoPurchase,66,0
hass3000-2,HASS3000.2: Finding and Working with Materials,The University of Newcastle Australia,NoPurchase,117,0
teaching-primary-science-chemistry-private,Teaching Primary Science: Chemistry (P),National STEM Learning Centre,SponsoredAccess,2,0
construction-project-risk-management,Construction Project Risk Management,Coventry University,NoPurchase,47,0
7069exq-03,"Qualitative, Mixed Methods and Contemporary Issues",Coventry University,NoPurchase,77,0
mindfulness-wellbeing-performance,Mindfulness for Wellbeing and Peak Performance,Monash University,UpgradedAccess,378343,1633
education-technology-leadership-in-schools,Leadership of Education Technology in Schools,Chartered College of Teaching,UpgradedAccess,5243,157
principles-of-wealth-management,Principles of Wealth Management,Hanken School of Economics,UpgradedAccess,10518,203
investigating-innovation,Investigating Innovation,Deakin University,UpgradedAccess,8716,97
sit716-2,SIT716.2 Moving Data,Deakin University,NoPurchase,139,0
understanding-digital-comics,Making and Understanding Web Comics,University of Dundee,UpgradedAccess,937,13
the-science-of-medicines-private,The Science of Medicines,Monash University,NoPurchase,88,0
pdsafe-falls-prevention-in-parkinsons-the-therapists-approach-,PDSAFE: Physiotherapy and Falls Prevention in Parkinson's,University of Exeter,UpgradedAccess,900,44
human-resource-development-and-learning-a,Human Resource Development and Learning (A),Coventry University,NoPurchase,44,0
applying-market-conditions-c,Applying Market Conditions and the Concept of Value Adding Services (C),Coventry University,NoPurchase,119,0
emergencies-disasters-trends-issues,Emergencies and Disasters: Trends and Issues,Coventry University,UpgradedAccess,1412,96
bringing-about-change-course-1,Bringing About Change,The Open University,NoPurchase,80,0
industry-sector-analysis-resource-based-view,Industry and Sector Analysis and the Resource-based View (C),Coventry University,NoPurchase,207,0
strategic-actions-et,"Strategic Actions, Strategic Goals",Coventry University,ExpertTrackAccess,44,0
entrepreneurial-sales-understanding-your-customer,Customer,Entrepreneurial Sales Institute (ESI),NoPurchase,13,0
leadership-service-improvement-7003cpd-05,Proposing and Evaluating a Service Improvement,Coventry University,NoPurchase,68,0
class-consumption-and-youth,"SOCA1010.2: Class, Consumption and Youth: Inequality and Ideology in Everyday Life",The University of Newcastle Australia,NoPurchase,280,0
7049crb-03,"Organisational Development, Design, and Assessment of Structural Inequality",Coventry University,NoPurchase,37,0
pmtheory03,Organisational Design and Culture,Anglia Ruskin University,NoPurchase,85,0
coventry-university-online-student-induction-bim,Coventry University Online BIM Student Induction,Coventry University,NoPurchase,34,0
social-impact-in-business-private,Social Impact in Business: How to Build a Brand that Matters,Good-Loop ,SponsoredAccess,45,0
organisational-behaviour-in-construction-an-introduction-c,Organisational Behaviour in Construction: An Introduction (C),Coventry University,NoPurchase,34,0
starting-a-business-private,Starting a Business: Realise Your Vision,University of Leeds,NoPurchase,154,0
investment-valuation,MMP742.1 An Introduction to Investment Properties,Deakin University,NoPurchase,162,0
study-skills-for-evidence-based-practice,Study Skills for Evidence Based Practice,Coventry University,NoPurchase,120,0
prince-2-practitioner-course-1,PRINCE2® - 6th Edition Practitioner: A FutureLearn course by QA,QA ,NoPurchase,12,0
strategic-choices-et,Strategic Choice and Planning,Coventry University,ExpertTrackAccess,43,0
capital-markets-impacting-factors,Capital Markets: Impacting Factors,Dublin City University,UpgradedAccess,9,0
frontier-technologies-senior-leadership,Frontier Technologies: Senior Leadership,Coventry University,NoPurchase,19,0
leading-managing-team-a2,Leading and Managing a Team (A2),Coventry University,UpgradedAccess,0,0
7107exq-04-c,"Fundamentals of Budgeting, Project Control and Earned Value (C)",Coventry University,NoPurchase,14,0
dsp-digitalmarketing-cp,Digital Skills: Digital Marketing,Accenture Skills to Succeed and Centrepoint,NoPurchase,10,0
leading-managing-team,Leading and Managing a Team,Coventry University,NoPurchase,4,0
ds-web-analytics-tag,Digital Skills: Web Analytics (TAG),Accenture Private,SponsoredAccess,0,0
independent-research-project-methodology-and-methods-cmbim-oc,Independent Research Project: Methodology and Methods (CMBIM),Coventry University,NoPurchase,6,0
dsp-analytics-learners,Digital Skills: Analytics,Accenture Skills to Succeed,NoPurchase,6,0
supporting-diverse-innovation,Supporting Diverse Innovation,UAL Creative Computing Institute,ExpertTrackAccess,6,0
letter-sounds-phonological-awareness-oxed,The Nuffield Early Language Intervention: Teaching Letter Sounds and Phonological Awareness - Training Course 3 of 3,OxEd and Assessment Ltd,SponsoredAccess,2,0
meaningful-participation-community-work-and-museums,Creating Meaningful and Inclusive Museum Practices with ICOM,International Council of Museums,UpgradedAccess,14,0
jess-test,Portfolio Sharing Link Test,FutureLearn,SponsoredAccess,1,0
capital-crear-un-plan-para-conseguir-inversionistas,Capital: crear un plan para conseguir inversionistas,10xU,ExpertTrackAccess,4,0
regression-analysis-digital-base-business,Regression Analysis and Digital Base for Business DO NOT USE,Coventry University,UpgradedAccess,0,0
research-methodology-a,Research Methodology (A),Coventry University,NoPurchase,2,0
fundamental-care-covid19-12,A Guide for Nurses on Meeting the Fundamental Care Needs of Hospitalised Patients with COVID-19 (12),University of Exeter,SponsoredAccess,0,0
7121maa-02,Supply Chain & Logistics Concepts - SC2,Coventry University,UpgradedAccess,0,0
21st-century-healthcare-leader-manager-a2,The 21st Century Healthcare Leader and Manager (A2),Coventry University,UpgradedAccess,0,0
f5006fd-sc10,F5006FD - SC10,Coventry University,UpgradedAccess,0,0
work-life-balance-remote-working-kick-start,Work-Life Balance and the Impact of Remote Working - BeReady Kickstart,Coventry University,NoPurchase,0,0
foundation-skills-for-nursing-care-09,Foundation Skills for Nursing Care 9,Coventry University,UpgradedAccess,0,0
independent-research-project-literature-review-emr-oc,Independent Research Project: Literature Review (EMR),Coventry University,NoPurchase,0,0
leading-and-managing-change,Leading and Managing People-Centred Change,Durham University,UpgradedAccess,20838,272
cambridge-english-ielts,Inside IELTS,Cambridge Assessment English,UpgradedAccess,428948,3
sustainable-construction-development,Sustainable Construction and Development,Chartered Institute of Building Academy,UpgradedAccess,11473,250
academic-integrity,Academic Integrity,The University of Auckland,UpgradedAccess,59717,69
the-science-of-nuclear-energy,The Science of Nuclear Energy,The Open University,UpgradedAccess,28183,112
business-analytics-forecasting,Business Analytics Using Forecasting,National Tsing Hua University (NTHU),UpgradedAccess,16541,91
research-project,Developing Your Research Project,University of Southampton,UpgradedAccess,134646,179
step-into-social-care,Step into Social Care,City & Guilds Group,UpgradedAccess,6421,39
basic-english-pre-intermediate,Basic English 2: Pre-Intermediate,King's College London,SponsoredAccess,346571,0
who-made-my-clothes,Who Made My Clothes?,University of Exeter,UpgradedAccess,18336,46
irish-language-8,Irish 108: An Introduction to Irish Language and Culture,Dublin City University,UpgradedAccess,2395,129
research-writing,Research Writing,University of Wollongong,UpgradedAccess,32240,143
medical-peace-work,Medical Peace Work,University of Bergen,UpgradedAccess,3708,2
robert-burns,Robert Burns,The University of Glasgow,UpgradedAccess,28013,319
palliative,Palliative Care,Lancaster University,UpgradedAccess,9721,2
ahl701-fl3,AHL701.3 Humanitarian Actors,Deakin University,NoPurchase,173,0
agriculture-economic-nature,"Agriculture, Economics and Nature",The University of Western Australia,SponsoredAccess,19792,0
jazz-piano,Learn Jazz Piano: Begin with the Blues,"Goldsmiths, University of London ",ExpertTrackAccess,16039,120
vet-school-application-support,Virtual Work Experience and Exploring the Veterinary Profession,The University of Nottingham,UpgradedAccess,13291,67
ib-extended-essay,The IB Extended Essay: Managing your Research Project,University of Leeds,UpgradedAccess,21098,41
coaching-mental-game,Coaching the Mental Game,Deakin University,UpgradedAccess,2665,2
maps-geospatial-revolution,Maps and the Geospatial Revolution,The Pennsylvania State University,UpgradedAccess,3271,2
economics-of-copyright-sp,Copyright y los Negocios de las Industrias Creativas,International Confederation of Societies of Authors and Composers (CISAC),UpgradedAccess,750,8
financial-analysis-for-business-decisions-intro-data-analysis-tools,Financial Analysis for Business Decisions: Introduction to Data Analysis Tools and Capital Projects,FutureLearn,ExpertTrackAccess,78,0
identifying-and-responding-to-drug-and-alcohol-addiction,"Identifying and Responding to Drug and Alcohol Addiction in Nursing, Midwifery and Allied Healthcare Practice",Trinity College Dublin,UpgradedAccess,581,51
dsp-socialmedia-vs,Digital Skills: Social Media,Accenture Skills to Succeed and Virgin StartUp,SponsoredAccess,459,0
teaching-climate-change,Teaching Climate Change,National STEM Learning Centre,UpgradedAccess,1229,63
stem-ambassador-induction-north-midlands,STEM Ambassadors Induction - North Midlands,STEM Ambassadors,SponsoredAccess,573,0
global-context,Global Context,Coventry University,NoPurchase,168,0
chinese-medicine-treatise-on-febrile-diseases-caused-by-cold,Chinese Medicine: Treatise on Febrile Diseases Caused by Cold (Shang Han Lun),HKU School of Professional and Continuing Education,UpgradedAccess,796,31
self-mgmt-long-term-conditions,Self-management of Long-term Conditions,Coventry University,NoPurchase,87,0
managing-workplace-emotion,Managing Workplace Emotion,Coventry University,NoPurchase,106,0
mechanics-of-search,Mechanics of Search: Information Retrieval Basics,Dublin City University,NoPurchase,34,0
defining-markets-business-models-trends,"Defining Markets, Business Models & Trends",Institut Français de la Mode (IFM),NoPurchase,253,0
politics-and-philosophy-in-leadership,International Leadership: Politics and Philosophy in Leadership,Coventry University,ExpertTrackAccess,39,0
project-monitoring-and-control-c,Project Monitoring and Control (C),Coventry University,NoPurchase,37,0
big-data,Big Data: Measuring And Predicting Human Behaviour,The University of Warwick,UpgradedAccess,33818,8
developing-leadership-foundations,Edward Jenner Leadership for Veterinary Professionals Part II: Developing Leadership Foundations,NHS Leadership Academy ,UpgradedAccess,5816,28
healthcare,Leadership for Healthcare Improvement and Innovation,The University of Warwick,UpgradedAccess,11513,205
good-pharmacy-practice-the-moderate,Good Pharmacy Practice: Introduction to Medication Delivery Systems,Taipei Medical University,UpgradedAccess,869,15
fundraising-for-non-fundraisers,How to Fundraise,The University of Kent,UpgradedAccess,6203,148
sit771-fl1,SIT771.1 Getting Started with Objects,Deakin University,NoPurchase,561,0
data-analytics-business-fundamentals,Data Analytics for Business Fundamentals,FutureLearn,NoPurchase,273,0
research-skills,Introduction to Research Skills,Dublin City University,NoPurchase,270,0
health-promotion,Capacity Building: Core Competencies for Health Promotion,Taipei Medical University,UpgradedAccess,284,26
ratio-analysis-c1,Ratio Analysis (C),Coventry University,NoPurchase,73,0
sit716-3,SIT716.3 Networks in Action,Deakin University,NoPurchase,139,0
processing-unstructured-data,Data Analytics and Data Mining: Introduction to Processing Unstructured Data,Dublin City University,NoPurchase,106,0
public-health-nursing-et-one,Public Health and Nursing: Drive Public Health Promotion,Coventry University,ExpertTrackAccess,113,0
case-studies-for-academic-business-reports-c,Using Case Studies as a Source for Academic Business Reports (C),Coventry University,NoPurchase,67,0
introduction-to-learning-and-the-role-of-a-trainer,Workplace Training: Introduction to the Training Cycle,ATC Training,ExpertTrackAccess,125,0
hospital-financing-3,HME705.3 Budget Control and Reporting,Deakin University,NoPurchase,85,0
