SLUG,PROMOTED_RUN_TITLE,ORGANISATION_TITLE,BUSINESS_MODEL,COUNT_UNIT_ENROLEMENT,UNLIMITED_ENRLEMENTS
language-assessment,Language Assessment in the Classroom,British Council,UpgradedAccess,47348,284
starting-a-business,Starting a business: realise your vision,University of Leeds,NoPurchase,12919,0
flexagons,Flexagons and the Math Behind Twisted Paper,Davidson Institute of Science Education at the Weizmann Institute of Science,UpgradedAccess,7159,145
maths-subject-knowledge-fractions-decimals-and-percentages,"Maths Subject Knowledge: Fractions, Decimals, and Percentages",National STEM Learning Centre,PaidForAccess,13176,269
preparing-for-life-in-school-and-facilitating-positive-learning-behaviour-secondary,Preparing for Life in School and Facilitating Positive Learning Behaviour,Coventry University,NoPurchase,330,0
history-of-the-book,The History of the Book in the Early Modern Period: 1450 to 1800,Trinity College Dublin,UpgradedAccess,10209,407
teaching-phonics,Teaching Phonics in Early Childhood,Queensland University of Technology,UpgradedAccess,74540,776
multilingual-practices,Multilingual Practices,University of Groningen,UpgradedAccess,11845,248
innovation-the-key-to-business-success,Innovation: The Key to Business Success,University of Leeds,NoPurchase,32750,0
bacterial-genomes-comparative-genomics-act,Bacterial Genomes III: Comparative Genomics using Artemis Comparison Tool (ACT),Wellcome Connecting Science,SponsoredAccess,10088,0
build-a-robot-arm,Introducing Robotics: Build a Robot Arm,Queensland University of Technology,UpgradedAccess,25030,32
finding-and-reading-research,Education Research that Matters: Applying Research to Your Teaching Practice,University of Birmingham,UpgradedAccess,4237,145
organ-donation,Organ Donation: The Essentials for Healthcare Professionals,"St George's, University of London",UpgradedAccess,6825,204
network-security,Network Security for Industry Professionals,Queen's University Belfast,UpgradedAccess,2519,2
physical-health-occupational-health-psychologists-in-action,Physical Health: Occupational Health and Psychologists in Action,Coventry University,NoPurchase,99,0
business-ethics,Business Ethics: Exploring Big Data and Tax Avoidance,University of Leeds,UpgradedAccess,4205,133
norwegian-for-beginners-3,Norwegian for Beginners 3,Norwegian University of Science and Technology (NTNU),UpgradedAccess,4249,130
hispanic-culture-film,Hispanic Film and Culture,Purdue University,UpgradedAccess,7183,8
data-in-tourism,Understanding Data in the Tourism Industry,Edinburgh Napier University,UpgradedAccess,3263,70
collecting-and-using-data-for-disease-control,Collecting and Using Data for Disease Control and Global Health Decision-Making,Johns Hopkins University,UpgradedAccess,832,69
dispute-settlement-construction-contracts-c,Dispute Settlement in Construction Contracts (C),Coventry University,NoPurchase,43,0
socs2200-1,SOCS2200.1: Introducing Social Theory and Bourdieu,The University of Newcastle Australia,NoPurchase,163,0
covid19-diagnostic-et-depistage,Diagnostic et dépistage de la COVID-19,"FIND, the global alliance for diagnostics",UpgradedAccess,450,5
aha716-3,ADH716.3 Going Home,Deakin University,NoPurchase,184,0
challenges-and-opportunities-in-global-marketing,Challenges and Opportunities in Global Marketing (C-LON),Coventry University,NoPurchase,31,0
stem-ambassador-induction-lanc-cumb,STEM Ambassadors Induction - Lancashire and Cumbria,STEM Ambassadors,SponsoredAccess,429,0
supply-chain-design,Supply Chain Design,The University of Warwick,SponsoredAccess,106,0
21st-century-healthcare-leader-manager-oc,The 21st Century Healthcare Leader and Manager,Coventry University,NoPurchase,83,0
japanese-book-paper-j,古書から読み解く日本の文化: 和本を彩る和紙の世界,Keio University,UpgradedAccess,174,5
geopolitical-economic-legal-environments-oc,"Geopolitical, Economic and Legal Environments",Coventry University,NoPurchase,34,0
ds-digital-fundamentals-acg,Digital Skills: Digital Fundamentals (ACG New Joiners),Accenture Private,NoPurchase,15,0
information-usage-and-communications-within-contemporary-organisations,Information Usage and Communications within Contemporary Organisations,Coventry University,NoPurchase,33,0
business-model-innovation-cyber,Business Model Innovation.,Coventry University,NoPurchase,18,0
joint-contract-tribunal,Introduction to the Joint Contract Tribunal (JCT),Coventry University,NoPurchase,41,0
dementia-care,Dementia Care,Newcastle University,UpgradedAccess,28145,232
teaching-for-home-learning-secondary-science,Teaching for Home Learning: Secondary Science,National STEM Learning Centre,UpgradedAccess,4717,130
right-to-education,The Right to Education,The University of Glasgow,UpgradedAccess,21109,152
taoism-and-western-culture,Taoism and Western Culture,DeTao Masters Academy,NoPurchase,8890,0
zoroastrianism-history-religion-belief,"Zoroastrianism: History, Religion, and Belief",SOAS University of London,UpgradedAccess,1523,72
strategic-leadership-and-successful-change-management-c1,Strategic Leadership and Successful Change Management (C-LON),Coventry University,NoPurchase,31,0
project-initiation-open,Project Initiation,Coventry University,UpgradedAccess,338,55
introduction-to-long-term-conditions-oc,Nursing and Long-term Conditions: An Introduction,Coventry University,NoPurchase,19,0
discovering-science-final-assessment,Discovering Science: Final Assessment,University of Leeds,NoPurchase,70,0
repression-and-revolt,HIST1002.3: Repression and Revolt,The University of Newcastle Australia,NoPurchase,120,0
maths-subject-knowledge-proportional-reasoning,Maths Subject Knowledge: Proportional Reasoning,National STEM Learning Centre,PaidForAccess,82,0
cuol-online-student-induction,Coventry University Online Student Induction,Coventry University,NoPurchase,85,0
ratio-analysis-a1,Ratio Analysis (A),Coventry University,NoPurchase,107,0
dispute-settlement-construction-contracts,Dispute Settlement in Construction Contracts,Coventry University,NoPurchase,39,0
hospital-financing-5,HME705.5 Financing Future Challenges,Deakin University,NoPurchase,83,0
pmtheory02,The Manager in the Organisational Environment,Anglia Ruskin University,NoPurchase,85,0
becoming-a-team-leader,Becoming a Team Leader,City & Guilds Group,ExpertTrackAccess,114,0
trainer-understanding-t-levels-for-frontline-staff,Trainer - Understanding T Levels for Frontline Staff,Education and Training Foundation (ETF),NoPurchase,55,0
leadership-theories,Leadership Theories,Coventry University,UpgradedAccess,0,0
project-execution-c,Project Execution  (C),Coventry University,NoPurchase,52,0
independent-research-project-literature-review,Independent Research Project: Literature Review,Coventry University,NoPurchase,152,0
the-interpretation-of-genetic-variation-and-the-acmg-framework-fundamental-principles,Interpreting Genomic Variation: Fundamental Principles,"St George's, University of London",UpgradedAccess,15,0
healthcare-clinical-governance,HME713.1 The Development of Clinical Governance,Deakin University,NoPurchase,53,0
decision-making-under-uncertainty-c,Decision-making under Uncertainty (C),Coventry University,NoPurchase,48,0
deep-learning-fundamentals,Deep Learning on Azure with Python: Reinforcement Learning,"CloudSwyft Global Systems, Inc.",ExpertTrackAccess,14,0
erlang-in-practice,TBC Erlang in Practice,The University of Kent,UpgradedAccess,0,0
hospital-clinical-governance-3,HME714.3 Standard Setting and Practice Measurement,Deakin University,NoPurchase,32,0
decision-making-risk-a,Decision-making and Risk: An Introduction (A),Coventry University,NoPurchase,10,0
how-children-learn-application-of-the-behaviourist-theory-primary,How Children Learn: Application of the Behaviourist Theory,Coventry University,NoPurchase,3,0
tackling-the-scale-up-challenge-understanding-the-internal-vectors,Tackling the Scale-up Challenge (4): Understanding the Internal meso-economic Vectors,EIT Food,SponsoredAccess,23,0
quantitative-research-methods-and-contemporary-issues-c,Quantitative Research Methods and Contemporary Issues (C2),Coventry University,NoPurchase,26,0
managing-in-a-healthcare-context-a2,Managing in a Healthcare Context (A2),Coventry University,NoPurchase,13,0
entrepreneurship-three,Ethics and Sustainability,Coventry University,UpgradedAccess,5,0
introduction-to-different-techniques-for-metal-additive-manufacturing,Introduction to Different Techniques for Metal Additive Manufacturing,EIT RawMaterials,SponsoredAccess,23,0
research-process-oc,Researching Perspectives and Practice,Coventry University,NoPurchase,24,0
special-diets-cooking-for-allergies-intolerances,Special Diets: Cooking for Allergies and Intolerances with BBC Good Food,BBC Good Food,ExpertTrackAccess,11,0
independent-research-project-writing-up-c3,Independent Research Project: Writing Up (C3),Coventry University,NoPurchase,7,0
fit-for-purpose-land-administration,TBC Fit-For-Purpose Land Administration,University of Twente,UpgradedAccess,7,0
get-ready-to-move-to-the-cloud-with-google-for-education,TBC Get Ready to Move to the Cloud with Google for Education,Tablet Academy,ExpertTrackAccess,4,0
business-etiquette,Business Etiquette,Swiss Education Group,PaidForAccess,15,0
implications-of-the-concept-of-equity-in-health-policy,The Implications of the Concept of Equity in Health Policy,Coventry University,NoPurchase,1,0
edward-jenner-0-planning-to-learn,Edward Jenner: 0 - Planning to learn,NHS Leadership Academy ,UpgradedAccess,9,0
equity-markets,Equity Markets,Dublin City University,UpgradedAccess,9,0
fundraising-strategy-for-senior-leaders,TBC Fundraising Strategy for Senior Leaders,University of Leeds,UpgradedAccess,0,0
aging-populations-j,人口の高齢化：日本に学ぶ「健康長寿」,Keio University,UpgradedAccess,1,0
investing-in-the-new-normal,How to Invest: Modern-Day Financial Decisions,Auckland University of Technology (AUT),UpgradedAccess,0,0
incident-command-and-review-oc,Incident Command and Review,Coventry University,NoPurchase,0,0
adapting-your-progress-for-pupil-practice-et,Adapting your Practice for Pupil Progress (ExpertTrack version),Coventry University,ExpertTrackAccess,1,0
creating-a-trusty,TBC Creating a trusty,Valerie Gauthier,ExpertTrackAccess,1,0
stem-managing-behaviour,Managing Behaviour for Learning (TEMP),National STEM Learning Centre,UpgradedAccess,1,0
cyber-crime-investigation-essentials-from-0-to-1nvestigator,TBC Cyber-Crime Investigation Essentials - From 0 to 1nvestigator,PA Consulting,ExpertTrackAccess,0,0
financial-control-and-planning-c,Financial Control and Planning (C),Coventry University,NoPurchase,1,0
youtube-video-creation-editing-and-engagement,"TBC YouTube Video Creation, Editing and Engagement",Social Media College,UpgradedAccess,0,0
transitions-in-care-c1,Transitions in Care (C),Coventry University,NoPurchase,1,0
icy-moons,Icy Moons,FutureLearn,ExpertTrackAccess,0,0
future-challenges-effective-crisis-management-oc,Future Challenges and Maintaining Effective Crisis Management,Coventry University,NoPurchase,0,0
application-of-robotics-tools-for-tourism-industry,Develop Tourism Apps Using Robotics Tools,Luleå University of Technology,UpgradedAccess,2,0
m3-4044exq-sc4,M3-4044EXQ-SC4,Coventry University,UpgradedAccess,0,0
what-is-the-acnc-and-its-role-,TBC What is the ACNC and its role?,Australian Charities and Not-for-profits Commission,UpgradedAccess,0,0
autism-and-healthcare,TBC Autism and Healthcare,The University of Kent,UpgradedAccess,0,0
good-pharmacy-practice,Essentials of Good Pharmacy Practice: The Basics,Taipei Medical University,UpgradedAccess,9705,87
global-disability,Global Health and Disability,London School of Hygiene & Tropical Medicine,UpgradedAccess,14726,157
explore-english-magna-carta,Magna Carta,British Council,ExpertTrackAccess,72438,0
blended-learning-getting-started,Blended Learning Essentials: Getting Started,University of Leeds,ExpertTrackAccess,53487,273
human-disease-lifestyle-environment,Causes of Human Disease: Nutrition and Environment,University of Leeds,UpgradedAccess,31090,489
adult-first-aid,First Aid for Adults,International Federation of Red Cross and Red Crescent Societies (IFRC),UpgradedAccess,18131,13
digital-cv,Net That Job,The University of Glasgow,NoPurchase,39924,0
talking-about-cancer,"Talking About Cancer: Reducing Risk, Early Detection and Mythbusting",Cancer Research UK,UpgradedAccess,27579,254
introducing-assessment-for-learning,Introducing Assessment for Learning,National STEM Learning Centre,ExpertTrackAccess,18594,372
programming-for-everybody-python-data-structures,Programming for Everybody: Python Data Structures,University of Michigan,UpgradedAccess,9227,179
forensic-psychology,Forensic Psychology,The Open University,UpgradedAccess,190643,845
study-skills-for-international-students,Study Skills for International Students,UEA (University of East Anglia),UpgradedAccess,22567,1
climate-change-and-resilience-in-food-systems,Climate Change and Resilience in Food Systems,University of Leeds,UpgradedAccess,2005,96
critical-care,Introduction to Critical Care Medicine,The University of Glasgow,UpgradedAccess,10186,258
norwegian-stave-churches,Preserving Norwegian Stave Churches,Norwegian University of Science and Technology (NTNU),UpgradedAccess,3105,234
global-resource-politics,Global Resource Politics,Hanyang University,UpgradedAccess,9227,114
demystifying-diabetes,Demystifying Diabetes,Deakin University,UpgradedAccess,8177,4
ethical-hacking-an-introduction,Ethical Hacking: An Introduction,Coventry University,UpgradedAccess,12403,177
data-explosion,Business Analytics: The Data Explosion,Kogod School of Business at American University,UpgradedAccess,6315,7
introduction-to-business-improvement,"Introduction to Business Improvement: Lean Six Sigma, Kaizen, and Problem Solving",Lean 6 Services,UpgradedAccess,867,63
health-workforce,Future-proofing the Health Workforce,Griffith University,SponsoredAccess,5402,40
humanitarian-logistics,Introduction to Humanitarian Logistics,Hanken School of Economics,UpgradedAccess,3313,113
start-a-coder-dojo,Start a CoderDojo Club,Raspberry Pi Foundation,UpgradedAccess,6769,65
smart-grids,Smart Grids for Smart Cities,EIT InnoEnergy,UpgradedAccess,2329,2
designing-for-a-sustainable-future,Designing for a Sustainable Future,Samsung,SponsoredAccess,2294,0
engaging-adult-learners-with-active-learning,Innovative Teaching: Engaging Adult Learners with Active Learning,University of Padova,UpgradedAccess,1792,120
monitoring-and-controlling-the-project,Monitoring and Controlling the Project,The University of Glasgow,NoPurchase,195,0
sit740-1,SIT740.1: Research and Development in Information Technology,Deakin University,NoPurchase,1671,0
implementing-iso27001,ISO 27001: ISO Implementation Practitioner,PA Consulting,UpgradedAccess,261,21
yourname-gdpr,Introduction to GDPR,FutureLearn Studio,SponsoredAccess,79,0
macro-environmental-analysis-and-business-strategy-et,An Introduction to Macro Environmental Analysis and Business Strategy,Coventry University,ExpertTrackAccess,172,0
state-mnc-relationships-services-tertiary-sectors,State-MNC Relationships in the Services and Tertiary Sector (C),Coventry University,NoPurchase,128,0
globalisation-global-health-public-health-oc,"Understanding Globalisation, Global Health and Public Health",Coventry University,NoPurchase,78,0
sit750-1,SIT750.1 Developing a Research Project,Deakin University,NoPurchase,104,0
the-neurobiology-of-addiction,The Neurobiology of Addiction,American Society of Addiction Medicine,ExpertTrackAccess,3,0
the-scientific-method,The scientific method,University of Groningen,NoPurchase,85,0
good-brain-bad-brain-parkinsons,"Good Brain, Bad Brain: Parkinson's Disease",University of Birmingham,UpgradedAccess,63025,297
scientific-revolution,The Scientific Revolution,University of Groningen,UpgradedAccess,8910,306
teaching-biology-inspiring-students-with-plants-in-science,Teaching Biology: Inspiring Students with Plant Science,National STEM Learning Centre,PaidForAccess,5031,128
mental-health-construction,Mental Health in Construction,Chartered Institute of Building Academy,UpgradedAccess,1109,77
career-smart,Career Smart,University of Reading,SponsoredAccess,1803,0
exploring-mapping-and-diagramming-techniques,Exploring Mapping and Diagramming Techniques,The University of Glasgow,NoPurchase,201,0
intrusion-detection,Intrusion Detection,Coventry University,NoPurchase,45,0
facilitating-social-learning,Facilitating Social Learning,Deakin University,NoPurchase,119,0
aha716-4,ADH716.4 Staying with the Neighbours,Deakin University,NoPurchase,184,0
soca3230-4,"SOCA3230.4: Consumption, Youth Cultures, and Postmodernity",The University of Newcastle Australia,NoPurchase,59,0
digital-storytelling-the-blup-way,Digital Marketing,Ravensbourne University London,UpgradedAccess,1533,40
measurements-using-nrm2-c,Measurement using NRM2 (C),Coventry University,NoPurchase,46,0
training-needs-analysis-hierarchical-task-analysis,Training Needs and Hierarchical Task Analysis,Coventry University,NoPurchase,95,0
hist2006-2,HIST2006.2: Crime and Colonialism,The University of Newcastle Australia,NoPurchase,245,0
7067exq-02-c,Financial Statements Analysis in Construction Firms (C),Coventry University,NoPurchase,22,0
report-writing-university-workplace-c,Report Writing at University and in the Workplace (C),Coventry University,NoPurchase,86,0
project-planning-control03,Controlling Project Costs,Anglia Ruskin University,NoPurchase,49,0
adh724-3,ADH724.3 DRR in Practice,Deakin University,NoPurchase,53,0
7107exq-02-c,"Construction Project Management Parameters, Tools and Techniques (C)",Coventry University,NoPurchase,17,0
impact-societal-culture-organisational-structure-c,The Impact of Societal Culture on Organisational Structure (C),Coventry University,NoPurchase,22,0
emotional-intelligence-at-work-kick-start,Emotional Intelligence at Work - BeReady Kickstart,Coventry University,NoPurchase,21,0
leading-healthcare-quality-improvement-and-organisational-effectiveness-a,Leading Healthcare Quality Improvement and Organisational Effectiveness (A),Coventry University,NoPurchase,36,0
healthcare-clinical-governance-2,HME713.2 Clinical Governance in the Global Context,Deakin University,NoPurchase,52,0
people-management-skills-fl,People Management Essentials,FutureLearn Staff,SponsoredAccess,17,0
organisational-design-structure-processes-c,"Organisational Design, Structure and Processes (C)",Coventry University,NoPurchase,25,0
human-capital-management-in-the-hospitality-industry,Human Capital Management in Hospitality,Universidad de Palermo,ExpertTrackAccess,0,0
soca3850-3,SOCA3850.3: Resilience and Revitalisation,The University of Newcastle Australia,NoPurchase,15,0
hkbu-create-futurelearn-courses,How to Create a Great FutureLearn Course,Hong Kong Baptist University,NoPurchase,18,0
key-competencies-and-capabilities-for-effective--leadership,Key Competencies and Capabilities for Effective Leadership,Dublin City University,UpgradedAccess,8,0
neurological-disorders-east-anglia,Neurological Disorders: How to Provide Care,UEA (University of East Anglia),UpgradedAccess,6,0
qualitative-mixed-methods-c,"Qualitative, Mixed Methods and Contemporary Issues (C2)",Coventry University,NoPurchase,21,0
cultural-differences-communication-styles-oc,Cultural Differences in Communication Styles,Coventry University,NoPurchase,1,0
corporate-level-strategies-oc,Corporate-level Strategy and the Strategic Implementation Canvas,Coventry University,NoPurchase,1,0
daimler-digital-leadership,Leading Digital (for importing purposes),Wolff Olins,UpgradedAccess,5,0
governing-your-charity-part-a-and-b,TBC Governing your charity: Part A and B,Australian Charities and Not-for-profits Commission,UpgradedAccess,0,0
disneyfication,Disneyfication and the Digital Dark Age,Coventry University,UpgradedAccess,0,0
evaluating-practice,Evaluating Practice,Coventry University,NoPurchase,3,0
meaning-emergency-preparedeness-oc,Understanding Emergency Preparedness,Coventry University,UpgradedAccess,0,0
language-teaching-in-primary-school,Language Teaching in Primary School: Issues and Opportunities,The University of Glasgow,UpgradedAccess,6,0
introduction-to-samuel-johnson-s-rasselas,Samuel Johnson’s Rasselas: An Introduction,Ralston College,UpgradedAccess,1,0
organisational-ethics-and-culture,Organisational Ethics and Culture - DO NOT USE,Coventry University,UpgradedAccess,0,0
intermediate-korean,Intermediate Korean: Exploring the Language and Culture of Korea,Hanyang University,UpgradedAccess,0,0
introduction-to-strategy-oc,Strategy as a Process and Measures of Success: An Introduction,Coventry University,NoPurchase,1,0
understanding-responsible-research-and-innovation,Understanding Responsible Research and Innovation (RRI),RMIT University,UpgradedAccess,1,0
games-for-change,TBC Games for Change,Abertay University,UpgradedAccess,0,0
understanding-ielts-reading,Understanding IELTS: Reading,British Council,ExpertTrackAccess,284538,359
english-in-early-childhood,English in Early Childhood,British Council,UpgradedAccess,219689,502
childhood-adversity-and-mental-health,Childhood Adversity: The Impact of Childhood Maltreatment on Mental Health,UCL (University College London) ,UpgradedAccess,22085,645
planning-collaboratively-primary,Planning Collaboratively,Coventry University,NoPurchase,129,0
inside-cancer,Inside Cancer,University of Bath,UpgradedAccess,53372,189
media-data,Making Sense of Data in the Media,The University of Sheffield,UpgradedAccess,14303,210
explore-filmmaking,Explore Filmmaking,National Film and Television School,UpgradedAccess,131169,174
european-empires,"European Empires: An Introduction, 1400–1522",The University of Newcastle Australia,UpgradedAccess,4983,282
understanding-adhd,Understanding ADHD: Current Research and Practice,King's College London,UpgradedAccess,91436,1647
introduction-to-business-management,Introduction to Business Management,King's College London,SponsoredAccess,120057,0
causes-of-war,Causes of War,King's College London,NoPurchase,18998,0
maternal-health,The Lancet Maternal Health Series: Global Research and Evidence,London School of Hygiene & Tropical Medicine,UpgradedAccess,9626,33
arts-and-technology,Arts and Technology Teach-Out,University of Michigan,SponsoredAccess,1292,0
music-moves,Music Moves,University of Oslo,UpgradedAccess,13822,91
surviving-the-workplace-on-managing-stress-and-building-confidence,Workplace Wellbeing: How to Build Confidence and Manage Stress,Luleå University of Technology,UpgradedAccess,3965,168
exploring-our-ocean,Exploring Our Ocean,University of Southampton,UpgradedAccess,59355,515
globalisation,International Affairs: Globalisation,The Graduate Institute of International and Development Studies,UpgradedAccess,14516,45
planning-research,Why Planning Your Research Matters,Deakin University,UpgradedAccess,7625,142
scientific-writing-and-reporting,Structured writing of your project or proposal,University of Groningen,NoPurchase,53,0
data-analytics-python-data-wrangling-and-ingestion,Data Wrangling and Ingestion using Python,FutureLearn,ExpertTrackAccess,101,0
operational-leadership-in-apprenticeships-people,Apprenticeship Leadership: Developing Your Team,Education and Training Foundation (ETF),SponsoredAccess,834,0
work-life-balance-impact-of-remote-working,Work-Life Balance and the Impact of Remote E-Working,Coventry University,NoPurchase,116,0
internet-of-things-iot-and-sustainability,Internet of Things (IoT) and Sustainability,The Mind Lab,UpgradedAccess,1226,53
computer-security-auditing-detection-and-response,Computer Security: Auditing Detection and Response,Dublin City University,NoPurchase,35,0
ux-design-fundamentals-management-business-model,UX Design Fundamentals: Creating business outcomes,FutureLearn,ExpertTrackAccess,74,0
coping-with-changes-ukrainian,«Як справлятися зі змінами: соціально-емоційне навчання через гру»,The LEGO Foundation,SponsoredAccess,505,0
sustainable-energy-access-for-communities,Sustainable Energy Access for Communities,UCL (University College London) ,UpgradedAccess,386,33
workplace-management,Workplace Management,Anglia Ruskin University,NoPurchase,37,0
formative-assessment-strategies-secondary,Formative Assessment Strategies,Coventry University,NoPurchase,187,0
strategic-leadership-and-successful-change-management-a,Strategic Leadership and Successful Change Management (A),Coventry University,NoPurchase,73,0
planning-the-project-ibm,Planning the Project (IBM),Coventry University,NoPurchase,71,0
thapar-mooc-lifecycle,MOOC Life Cycle,Thapar University,NoPurchase,109,0
adh701-5,"ADH701.5 Engaging Communities in the Generation, Analysis and Use of Evidence in Humanitarian Crises",Deakin University,NoPurchase,19,0
uncovering-your-entrepreneurial-potential-ef,Uncovering Your Entrepreneurial Potential,Coventry University,NoPurchase,49,0
motivation-engagement,Motivation and Engagement in an Uncertain World,Coventry University,SponsoredAccess,5491,0
storytelling-for-social-change,Storytelling for Social Change,University of Michigan,UpgradedAccess,4265,187
antimicrobial-stewardship-for-the-middle-east,"Antimicrobial Stewardship for the Gulf, Middle East and North Africa",BSAC,UpgradedAccess,2834,46
programming-with-guis,Programming with GUIs,Raspberry Pi Foundation,UpgradedAccess,8876,147
industry-sector-analysis-resource-based-view-oc,Industry and Sector Analysis and the Resource-based View,Coventry University,NoPurchase,51,0
community-preparedness-planning,Community Preparedness and Planning,Coventry University,NoPurchase,61,0
project-planning-control02,Managing Time and Resources,Anglia Ruskin University,NoPurchase,50,0
environmental-challenges-final-assessment,Environmental Challenges: Final Assessment,University of Leeds,NoPurchase,155,0
what-you-need-completing-your-assessment,What You Need to Complete Your Assessments,Coventry University,NoPurchase,46,0
